id,获赞数,评论数,分享数,上架时间,title,字幕
47,62000,1734,3975,2019-10-29 18:59:12,"掌阅,《82年生的金智英》,生而为女人,不必抱歉","据说每一个推荐过这本书的,女艺人都被骂了,今天要说的,就是这本在韩国饱受争议的书,《82年生的金智英》,书中女主放学路上,被变态跟踪,却被爸爸指责穿的太少,考大学肘被父母强迫,考师范学校,因为老师是最适合女生的工作,结婚后表偶式的育儿,让她精神崩溃,患上了抑郁,作者通过这个故事告诉我们,你无法想象一个女孩,要经历多少看不见的坎坷,才能跌跌撞撞地长大成人,现在的环境中,对于女性的各种隐性的,歧视和偏见难以磨天,我们难以拥有自我,只能被定义、被标签,希望每一个女性,都可以不被,“女人”的身份所束缚,拥有更自由更坦然的人生,0K我是 Caroline,关注我,每天一本好书,带您品味人生百态"
46,81000,3844,14000,2019-10-26 18:31:09,"掌阅,《最好的我们》,并不是所有的付出都要有回报","你经历过这些吗,对朋友掏心掏肺,却没有换回他的坦诚相待,为工作精疲力尽,可却没有拿到,令人满意的薪酬,对恋人一心一意,结果没能走到最后,可能这个世界上大多数付出,都没有与回报成正比,但一个人的付出,本就是心廿情愿的事情,《最好的我们》中有一句话,奔波的人生,我们已经用心、尽力,何必还去耿耿于怀,其实多数时候,我们并没有想过回报,因为付出的每个瞬间,都会成为记忆中的小美好,所以为何还要对结果耿耿于怀,反而因为我们没有期待,当有所收获的射候,才会更加地惊喜,虽然这短短的一生终将失去,不妨勇敢一点,不要让害怕付出,成为你爱而不得的理由,0K,我是 Caroline,关注我,每天一本好书,带您品味人生百态"
45,312000,14000,55000,2019-10-26 09:30:16,"掌阅,《亲密关糸》,出轨是否该被原谅","有很多人问,另一半出轨了,我要不要原谅ta,可能本就不存在,原谅这个答案吧,无论怎样你都会发现,你再也不会信任ta了,当ta换了新的发型,你会担心是给谁看,当ta不回家吃饭,你会猜疑是和谁在一起,ta花的每一分钱,生活里的每一个举动,都会令你不安,你们之间就像,《亲密关糸》里说的一样,过去的事就如同魅影一样,如影随形挥之不去,脑海中会不新想起那个,最不愿想起的画面,然后后悔,我为什么还要和他继续在一起,其实这很正常,因为我们都不是圣人,所以做不到既往不咎,面对你的伤害,我还是做不到释怀,那就算了吧,何必用别人的错误伤害自己呢,0K我是 Caroline,关注我,每天一本好书,带您品味人生百态"
44,117000,6008,23000,2019-10-24 18:42:31,"《小王子》,成年人也是过期了的小朋友","有人说,成长就是闭上了嘴,低下了头,不知道什么时候开始,我们总是扮演一个,个不动声色的大人,明明我们小附候想哭就哭,想笑就笑,这一秒想要抱抱,就绝不会等到下一秒,而现在,哪怕心里再苦,也要装作若无其事,《小王子》中有一句话,所有大人,都曾经是个小孩,却只有少数的人才记得,成年人其实也不过,是在小孩的世界里,努力扮演看成熟的大人,边抵抗看成长,想保留单纯和童真,一边逼隐忍,慢慢变圆滑和强大,一面向上攀爬,面向下倒娟,我并不觉得成年人的情绪稳定,是一种赞美,生活已经这么苦了,你又何必如此懂事,当情绪的堤坝快要崩溃肘,就由它泥沙俱下,别忘了,你可以善待你的悲伤和脆弱,因为你也只是个,刚过期的小朋友啊,0K我是 Caroline,关注我,每天一本好书,带您品味人生百态"
43,122000,4588,15000,2019-10-22 18:40:51,"《独居日记》,没有谁是为了谁而存在,1*自","你在爱情中缺乏安全戚吗,天问男朋友八百遍,你爱不爱我,不自觉的和他前女友比较,患得患失,不停地给对方发信息,还必须秒回,偶尔他加斑晚归,就担心他有了别人,吵架就说分手,来证明自己的重要性,因为你恿觉得他会离开,总觉得即使他离开,你都不会知情,把所有的安全戚,寄托到对方身上,但一次次换回的总是失望,《独居日记》中写到,要学会轻淡无形,保持足够的距离,在爱情里,我们要学会多爱自己,当把自已的人生,经苦的明明白白时,根本无需要多加讨好,对方就会像块被吸引的磁铁,不由自主地靠近你,保持距离并不代表不爱,只是因为在这个世界上,从来没有谁,是为了谁而存在的,0K我是 Caroline,关注我,每天一本好书,带你品味人生百态"
42,58000,2492,4467,2019-10-20 18:13:30,"《王尔德作品集》,我希望你过得好但不要比我好,厂2","你有嫉妒过你的朋友吗,当朋友上了名牌大学,找到了高薪的工作,嘴上说着祝福,但心里有时会想,为什么她这么幸运,怎么不是我,想完了又为自己的阴暗面威到愧疚,就像《王尔德作品集》中写道,要消受一个春风得意的朋友,需要非幸优良的天性,可能对于大多数女生而言,友情大概就是,我希望你过得好,但不要过得比我好,嫉妒其实是生活里的一种常态,宅让我们的关糸出现裂痕,让我们心存不安,但它在友情中不一定是一件坏事,正是因为我们身上,让对方所嫉妒的一切,才让我们成为了朋友,毕竟真正的友情,不一定是一尘不染,而应该是瑕不掩瑜,0K,我是 Caroline,每天一本好书,带您品味人生百态"
41,157000,9164,36000,2019-10-18 18:35:42,失望从来都不是一蹴而成,"我爱你但我已经不再喜欢你,是一种什么感觉,有一个回答是,我懂你的苦衷,也理解你的难处,我只是失望了,往后余生不想再与你相见,是从什么射候开始失望的呢,是加班到凌晨,另一半却因为要打游戏让自己回家,还是期待了很久的情人节,另一半却心不在焉毫无准备,约定好的旅行,想去看的电影,恿是一拖再拖,最后不了了之,失望从来都不是一蹴而成的,因为离开是一场长久的预谋,在决定放弃一个人之前,一定是在风中站了很久,只是被偏爱的人总是有恃无恐,以为你不会走,殊不知爱是有期限的,当被喜欢的时候不珍惜,可能分开了留下的只有遗憾,所以珍惜身边那个,满眼是你的人,毕竟她爱你,就像爱自己的生命,0K,我是 Caroline,关注我,每天一本好书,带您品味人生百态"
40,48000,2578,8960,2019-10-16 18:35:32,"《流全岁月》,不必试图让所有人都开心","你周围有这样的人吗,在你素颜的时候,她说你不修边幅,在你化妆的时候,她说你浓妆艳抹,当你被夸奖,她说你讨好上司,当你被批评,她又说你能力不行,即使你躺倒在地,让她踩在你身上,她还是会抱怨,踩看不够舒服,你永远都达不到,她心里的合格线,《流金岁月》里,有一句话说的特别好,无论做什么,记得为自己而做,我们没有必要介意,别人的评头论足,更没有必要,畏惧别人的嘲笑,因为评头论足,只是无聊人的消遣,取悦别人,也不是我们的“潜规则,乍见之欢,不如久处不厌,人生只有一次,所以一定要和让你开心的人,起度过,就算无人欣赏,我们默默绽放自已也好,很经朋反和信间我,很多朋及私信我,多朋友私信间杀,在哪里看带,在哪里昂书,给火家推落下拿阅@pp,给大家推荐下掌阅@pp,做近正好有,最近正有,你听书我买单的诺动,你听第我买的动,很多推荐过的书,都是兔费的,快去试动吧,快去认吧"
39,1134000,52000,171000,2020-01-01 12:00:00,"我爱你,但我已经不喜欢你了","和一个很爱的人分手,是什么威觉,可能就像,一个长发姑娘剪了短发,习惯性的摸发尾才意识到,原来一切都变了,走在有你的城市里,总觉得哪里都是你,就算离开,心里也无法忘记,喜欢你是真的,努力靠近你是真的,想要走到最后的心,也是真的,但一次比一次的寒心,更是真的,心有不甘却又无以为继,可能我们最好的结局,就是杳无音信吧,我们之间就像乘法一样,只要一方为零,即使另一方再努力,结果还是委,我爱你,从满心欢喜到心如死寂,你好像很爱我,但又好像没爱过,其实结束这段关糸,并不是没收你的幸福,而是老天都在心疼你,所以让你得以解脱,毕竟缘分的事,不负此生真的太难了,0K我是 Caroline,关注我,带您品味人生百态"
38,49000,1996,5860,2020-01-01 12:00:00,"真正的修养,是尊重每一个人","我有一个朋友她家境很好,但当她和收入不高的朋友,出来玩的时候,总是去一些,经济实惠的餐厅吃饭,她说,在不适当的场合,展现自己的优越威,会给别人带来压力,哪怕这并不是你的本意,这并不能,给别人带来什么帮助,只能让别人觉得你在炫耀,并产生一种距离感,我想,一个人的修养,往往不体现在,他如何对待,比自己身份高的人,而是体现在,比自己身份低的人,的确不同的家庭,经历和环境,会让很多人,有看无法避免的局限,当我们面对这些局限的时候,更应该保持一份同理心,尊重和体谅他人,毕竟,真正自信的人,并不需要,用这种在弱者面前的炫耀,依靠他人羡慕的方式,来增添自己的底气,0K,我是 Caroline,关注我,每天一本好书,带您品味人生百态"
37,72000,2700,10000,2020-01-01 12:00:00,"《撒哈拉的故事》,爱情就是最高的标准","三毛在《撒哈拉的故事》中,有一段这样的对话,荷西:你想嫁个什么样的人,三毛:看得顺眼,千万富翁也嫁,看不顺眼,亿万富翁也嫁,荷西:说来说去,你还是想嫁个有钱人,毛:也有例外的肘候啊,要是你的话,只要够吃饭的钱就够了,荷西:那你吃得多吗,毛:不多不多,以后还可以少吃一点,在坠入爱河之前,我们总是会给恋爱对象,设定很多的标准,他要有钱,要英俊、要温柔,然而爱情的微妙之处就在于,当我们遇到的那个人,明明所有的原则和条件,都和他相悖,我们依然被动陷入,无法自控的为他心动,不是你发现,对方符合你的要求,而是你愿意为了他,改自己的标准,0K,我是 Caroline,关注我,每天一本好书,带您品味人生百态"
36,112000,8834,16000,2020-01-01 12:00:00,"《与抑郁症相伴的日子》,你就是他们的星星","你可能不知道,全球罹患抑郁症的人,已经超过3个亿,也就是说,每25个人当中,就有1位抑郁症患者,前两天在WB上,看到这样一个故事,位患有抑郁症的姑娘,在家GW,清酲后打车去医院,在出租车上,她手上的弄脏了后座,本以为会被司机责怪,没想到司机送她,去医院处理完伤口后,还带她去吃了晚饭,饭桌上司机对她说,十来岁的小姑娘,人生的路还很长,千万别学我女儿,《与抑郁症相伴的日子》里,有这样一句,描写抑郁症患者的话,我也不想这么糟糕,但我知道我病了,我想要努力微笑,但对不起,我已经很久没有,感受到快乐是什么样子了,其实每个抑郁症患者,都不想放弃自己,他们为了爱他们的人,努力咬紧牙关,但只是有肘候,一个人真的,有些无能为力,他们走在悬崖边上,你的安慰可能就是,把他们拉回人间的希望,对于站在黑暗里的他们,每个人的爱,都是熠熠闪烁的星光,0K,我是 Caroline,关注我,每天一本好书,带您品味人生百味"
35,41000,2541,9698,2020-01-01 12:00:00,"《诗与少年》,芸芸众生都身在苦海","我们总会羡慕别人,怀疑为什么就自己这么惨,小城市的人觉得生活索然无味,羡慕大城市的人工作充满挑战,殊不知大城市的人,被996压得喘不上气,羡慕看小城市的自由惬意,写字楼里的白领,为裁员的消息心惊胆战,羡慕铁饭碗的稳定安心,而铁饭碗却看看自己的收入,愤愤不平,羡慕看白领的薪酬高昂,其实我们美慕看别人的同射,其实我们羡慕着别人的同时,自已也在被别人羡慕着,正如《诗与少年》中写道,仰望星空的人,恿以为星空就是宝石,只有飞上星变的人才知道,那儿有灰尘、石渣,和地球一样复杂,我们看到的总是,别人光r亮丽的一面,却看不到他们背后的狼狈不堪,每个人都觉得自已在苦海,别人在岸上,实际上,芸芸众生,都身在苦海,0K我是 Caroline"
34,76000,4846,15000,2020-01-01 12:00:00,"《我想和这个世界谈谈》,真正的孤独来自最亲近的人","我们总以为,孤独是没有朋友,没有恋人,但其实真正的孤独,往往来自于那些,最亲近的人,向恋人倾诉情绪时,他不耐烦的说,又怎么了,向朋友抱怨不满时,朋友心不在焉的回应着,在每个期望,落空的时刻,都让我们倍感孤独,越多期待换回的,越多的失望,我们彼此就像,生活在,同一个屋檐下的平行线,即使那么亲近,也没有半分,灵魂上的共呜,正如韩寒在,《我想和这个世界谈谈》中写道,你懂得越多,你就越像,这个世界的孤儿,走得越远越明白,这个世界本是孤儿院,可能我们每个人,都像一座孤马,谁也不能,完全的理解谁,虽然我们一起玩耍,一起工作,起生活,但最后的最后,人生终将是一场,单人的旅行,0K我是 Caroline,关注我,每天一本好书,带你品味人生百态"
33,130000,3000,6902,2020-01-01 12:00:00,"《暗恋・橘生淮南》,所爱隔山海,山海皆可平,s il","据说在距离我们,几十万公里的月球上,每年都会发生,1000余次的月震,但地球上的人却浑然不知,这感觉有点像暗恋一个人,你沾在他面前心跳如鼓,他却什么都不知道,你想要他知道,却又害怕他知道,《暗恋・橘生淮南》中说,两个陌生人坠入爱河,只有一个知道爱绝非巧合,能遇见就够了,喜欢就够了,知道你在这世界上就够了,虽然希望能修成正果,但只要结果不要太惨,都比你我之问,仅有一片空白要好,所爱隔山海,山海皆可平,既然心里偷偷对他许诺了,全世界的偏爱,不妨大胆一点,爱一个人攀一座山,追一个梦,不要让暗恋的他,成为心底的白月光,而是变为,陪伴你往后余生的另一半,0K我是 Caroline,关注我,每天一本好书,带您品味人生百态"
32,60000,2315,10000,2020-01-01 12:00:00,"《爱你就像爱生命》,爱情本该有的样子,王小波李银河――《爱你就像爱生命》,我把我整个灵魂都给你,连同它的怪癖,耍小脾气,忽明忽","我把我整个灵魂都给你,连同它的怪癖,耍小脾气,忽明忽暗,一千八百种坏毛病,它真讨厌,宅真讨厌,但只有一点好,那就是爱你,《爱你就像爱生命》中,描绘了爱情本该有的样子,但我们却总是,刻意的掩盖掉,那些我们无法轻易,改掉的缺点,在一段恋爱的起始阶段,只想看给对方,展示好的一面,然而t会逐渐发现,我们的小脾气,我们的坏毛病,我们的一切不足,然后说出那句,我们最不想听的话,你变了,你让我感觉好陌生,其实我们自始至终,都没有变过,只不过总想让他,看到最好的自己,也许,爱情本该有的样子,就是我忍不住,想把所拥有的一切都给你,即使是我自己,也很讨厌的坏毛病,因为好也罢,坏也罢,那都是我,0K我是 Caroline,关注我,每天一本好书,带你品味人生百态"
31,78000,648,2160,2020-01-01 12:00:00,祝祖因母亲70周年快乐,"提起爱国,很多人想到的是教育,但对我而言,爱国是一种民族归属感的体现,是一种当你在海外看到,五星红旗升起的时候,热血沸腾,热泪盈眶的情愫,我少小离家在海外求学,为了很好的融入当地社会,无法避免的,尽量的少用中文,后来慢慢明白,无论我走到哪里,我的根,永远在中国,我永远流淌看,老祖宗的血脉,2011年,因为工作出国采访,等采访结束的时候,当地已经战乱,遍地死伤,炮火纷飞,而就在这时,祖国母亲相继派出了军队,帮助我们华侨,中资机构,撤离了危险之地,当我踏上回国的土地,听到工作人员对我说,欢迎回家,我激动的无以言表,我只觉得只要五星红旗,升起的地方,那都是家,无论你正面临看什么样的危险,无论你在世界的哪个角落,阻国母亲,都永远保护看我们,此生无悔入华夏,来世还做中华人,我是挛阅赵涵,祝我们祖国母亲,生日快乐"
30,41000,531,3350,2020-01-01 12:00:00,"《攀登者》,高矮险峻,各不相同","我想每个人,都想过追求梦想吧,在你追求梦想的路上,有人会说,没有梦想,你和咸鱼有什么区别,也有人说,自求梦想,不如先把饭吃饱,梦想就像一座山,而我们总在攀登的路上,《攀登者》里有这样一句话,我们自己的山,自己要登上去,只不过对于每个人,要攀登的山不尽相同,就像每个人的梦想,也都不太一样,有的人雄心壮志,想要凭自己改变世界,但有的人知足常乐,只想平淡的过好一生,雄心壮志的人固然值得敬佩,但是过好普通人的一生,也不是一种平凡,毕竞在我们的心里,都有自己的一座山,只是高矮险峻,各不相同,0K我是 Caroline,关注我,每天一本好书,带您品味人生百态"
29,145000,4767,17000,2020-01-01 12:00:00,"《倾城之恋》,担当不起就不要枉费","我有个朋友跟我抱怨,他的另一半,以前交往过很多人,我和他说,如果你介意,就直接开口告诉人家,别耽误了人家,可他却告诉我说,另一半对他很好,怕分手了找不到更好的,我很想和他说,如果不能接受,这个女生的曾经,又何必要枉费她的将来呢,让一个,心对你好的女孩,直生活在谎言和芥蒂中,这是多么的不公平,你可曾想过,她其实也想早点遇见你,甚至还会嫌弃自己的过去,没能把最好的自已留给你,《倾城之恋》这本书中说,如果你认识以前的我,你就会原谅现在的我,但比起原谅,更希望你能遇见那个,闭口不谈你的过去的那个人,因为他只想,参与到你的未来,0K我是 Caroline,关注我,每天一本好书,带你品味人生百态"
28,36000,1669,5669,2020-01-01 12:00:00,"远离性格极端的爱人,s il","经常看到女孩,和周围的人秀恩爱,展示男朋友多爱自己,不许她穿吊带和短裤,出去一会儿就打十几个电话,每天都要黏在一起,就算是吵架,男生也会主动认错甚至下跪,但我每次都特别,为这些女生威到心惊肉跳,因为占有欲和控制欲啊,它不是爱,这种极端的情绪,可能在你们分手的时候,就转化为危险,我朋友贝贝分手的时候,就遇见过这种危险,因为极端的占有欲,她前男友无法接受分手,带看刀冒充成快递员,到楼下堵她,还好贝贝及射报警,最终没有发生不可挽回的惨剧,所以我想特别想提酲,广大女生们,远离性格极端的男生,别被所谓的,都是因为我太爱你了,蒙上双眼,毕竟爱你的肘候,可以为你挡刀的人,也可能在分手之后,插你两刀,0K我是 Caroline,关注我,带您品味人生百态"
27,54000,2116,4645,2020-01-01 12:00:00,"《解忧杂货店》,未知让我害怕前进","你有想过要换一份新的工作,或者一种新的生活方式吗,你是因为什么放弃了,有人在工作中毫无理由的,被上司骂了个狗血淋头,直到晚上回家还愤愤不平,想着一定要辞职,结果第二天,又准时准点的迈入公司,理由是如果辞了职,不知道还能不能找到,这么高薪的工作,算了吧,还是忍忍吧,我们总是在,给自己的怯懦找借口,但其实一切全在于你自己,就像《解忧杂货店》中说的那样,对你来说,一切都是自由的,在你面前是无限的可能,我衷心祈祷你可以相信自己,无悔的燃烧自已的人生,的确在你准备迈出门槛,却被现实砸坐回地板的时候,会有一些委屈和无奈,但生活不止眼前的苟且,还有看诗和远方,0K我是 Caroline,关注我,每天一本好书,带你品味人生百态"
26,63000,3010,9187,2020-01-01 12:00:00,"《无声告白》,终其一生要找到真正的自己,L","我是为你好,这句话你听过吗,当你想去大城市打拼,会有人说,你又买不起房,就别耽误时间了,当你去选择自已喜欢的工作,会有人说这个不稳定,不如去考个事业单位吧,当你想要追逐诗和远方,会有人说现实点吧,最有说服力的借口,步一步把我们拖进平庸,《无声告白》中,有这样一句话,我们终其一生,就是要摆脱别人的期待,找到真正的自己,可能真实的旬己赚不到什么钱,也很难获得成功,但这就是我想要的人生,我和你走在不同的路上,我们之间没有,谁比谁走的更好,就像悉尼的时间,是比东京早1个小时,但东京的时间,也同样没有变慢,因为在命运的安排下,切都很准时,0K我是 Caroline,关注我,每天一本好书,带您品味人生百态"
25,51000,2834,8059,2020-01-01 12:00:00,"《少有人走的路》,做个“舔狗”又如何","我特别讨厌“舔狗”这个词,就好像对一个人痂情,是一件错事一样,总有人说,在爱情里不要做个输家,所以把痴情,称为卑微的一厢情愿,把忘我的爱意称为舔狗,但爱情,不就是我心甘情愿被你浪费吗,所以我不明白为什么,总是有人在爱里,要求对方给予回报,《少有人走的路》里,有一句话我特别喜欢,他说,我们真心去爱别人,是因为我们需要爱他,爱的存在本身就是回报,它是我们疲惫生活中的英雄梦想,是让世界熠熠生辉的威大烙火,是让我们觉得这个世界,还不错的全部理由,所以做个舔狗又怎样,能遇到一场心甘情愿的沉沦,多么地珍贵,0K我是 Caroline,关注我,每天一本好书,带您品味人生百态"
24,149000,4289,16000,2020-01-01 12:00:00,无,无
23,74000,3500,7850,2020-01-01 12:00:00,"《孤独六讲》,孤独,是另一种自由","您可能不太相信,我国的单身人口,已达到了2.4个亿,我身边也有不少单身的朋友,有的呢是一直不想找,有的是没射间找,有的,则是找了也找不到,相较而言,单身的人看起来有些孤独,身边的人都是出双入对,一到情人节,朋友圈里全是狗粮,就连吃个火锅,都不敢去厕所,怕回来餐具就被收走了,但就像《孤独六讲》中说的一样,孤独和寂寞不一样,狼独是饱满的,所以与其为了不孤独,而选择陪伴,不如在一个人的独处中,收获惊喜,正如谢耳朵说的那样,或许我旬已太有意思,无需他人陪伴,而所谓的“孤独”,本就是一种自由,0K我是 Caroline,关注我,每天一本好书,带您品味人生百态"
22,665000,34000,90000,2020-01-01 12:00:00,"《而已集》,世界上没有真正的威同身受","有人说,难过的时候,千万不要找别人聊天,的确,越长大越觉得,比起诉说自己的委屈和不甘,还是沉默最好,因为绝大多数的人会漠不关心,还有一部分人,会把你的伤痛,当做说笑的谈资,而真正在乎你的人,却心有余而力不足,无法懂你的痛苦,鲁迅先生在《而已集》中,说过这样一句话,人的悲欢并不相通,我只觉得他们吵闹,人总是这样,事不关已高高挂起,劝你大度劝你勇敢,等真到了自已身上,才知道很多事情,远不是勇敢大度就能解决的,生活哪里有什么感同身受,不过是如鱼饮水,冷暖自知罢了,所以我们最应该争取的理解,应该来自于自己,毕竟,万般痛苦,唯有自渡,0K我是 Caroline,关注我,每天一本好书,带您品味人生百态"
21,63000,2309,2757,2020-01-01 12:00:00,被“伪独立”У舻牡贝女性,"我一直觉得我的朋友安琪,是个标准的独立女性,她从一个小职员,路奋斗成了企业的高管,年入百方,也有自己的社交圈,一个人过的自得其乐,直到今年,她嫁给了一个上市公司的CEO,放弃了自己的事业和生活,选择做了一名全职太太,我问她为什么,她说我之前那么努力,就是为了嫁得更好啊,现在很多女生的潜意识里,还是觉得,女人最好的归宿是嫁人,并不相信能靠旬己,就能获得想要的一切,她们把独立女性的标签,当做帮助旬己实现,阶级跃迁的敲门砖,一切的努力只是为了,帮助自己遇到,白马王子,说白了,这可能只是一种“伪独立”,而真正的独立,是不依附于他人的存在,经济独立的同时,也保持思想上的独立,希望每个女孩都能明白,你不属于任何人,你只属于你自己,0K我是 Caroline,关注我,带您品味人生百态"
20,88000,3126,6208,2020-01-01 12:00:00,"《王尔德诗选》,爱旬己,是终身浪漫的开始","大概每个女生,都被挑剔过外貌吧,如果你身材不够苗条,买衣服的时候会被导购提醒,没有加大的尺码,如果你的皮肤不够白皙,穿粉色的衣服,会被身边的人吐槽,这么穿更黑了,如黑你身高不够高挑,谈恋爱的射候,会被对方的父母嫌弃,影响了下一代的基因,这种身体上的羞辱让我们自卑,为了迎合大众的审美,我们会尽可能的,掩藏自己的不足,但我想告诉每个女孩,我们的身体是自已的领地,谁都没有资格评头论足,服粗的女孩也可以穿短裤,皮肤黑的女孩,也可以穿r艳的衣服,就算矮小的女孩,你也可以只穿平底鞋,在《王尔德诗选》中写道,爱自己是终身浪漫的开始,如果这个世界,非要对“美”有什么标准的话,那我希望,是由我们自己来定义,因为你自信的样子,就很美,0K我是 Caroline,关注我,每天一本好书,带您品味人生百态"
